{
  "schema_version": "commandgraph.command_card.v1",
  "command": "docker",
  "summary": "Build, run, inspect, and manage containers.",
  "aliases": ["container", "image", "docker compose"],
  "intents": ["list containers", "show docker images", "clean docker cache", "run container"],
  "default_risk": "medium",
  "risk_tags": ["container_runtime", "filesystem_write", "network_access"],
  "requires_privileges": ["container_runtime_access"],
  "subcommands": {
    "ps": {"effects": [{"effect": "container.read", "resource": "container_runtime"}]},
    "images": {"effects": [{"effect": "container.read", "resource": "container_runtime"}]},
    "inspect": {"effects": [{"effect": "container.read", "resource": "container_runtime"}]},
    "run": {"effects": [{"effect": "container.create", "resource": "container_runtime"}]},
    "create": {"effects": [{"effect": "container.create", "resource": "container_runtime"}]},
    "start": {"effects": [{"effect": "container.create", "resource": "container_runtime"}]},
    "rm": {"effects": [{"effect": "container.delete", "resource": "container_runtime"}]},
    "rmi": {"effects": [{"effect": "container.delete", "resource": "container_runtime"}]},
    "volume rm": {"effects": [{"effect": "container.delete", "resource": "container_runtime"}]},
    "network rm": {"effects": [{"effect": "container.delete", "resource": "container_runtime"}]},
    "system prune": {"effects": [{"effect": "container.prune", "resource": "container_runtime"}]},
    "image prune": {"effects": [{"effect": "container.prune", "resource": "container_runtime"}]},
    "container prune": {"effects": [{"effect": "container.prune", "resource": "container_runtime"}]},
    "volume prune": {"effects": [{"effect": "container.prune", "resource": "container_runtime"}]}
  },
  "examples": [{"command": "docker ps", "explanation": "List running containers."}],
  "templates": [{"command": "docker ps", "description": "List running containers."}, {"command": "docker images", "description": "List local images."}]
}
