{
  "schema_version": "commandgraph.command_card.v1",
  "command": "apt-get",
  "summary": "Manage Debian-family system packages in scripts and automation.",
  "aliases": ["debian package manager", "apt get", "apt-get install"],
  "intents": ["install system package with apt-get", "remove system package with apt-get", "update package index"],
  "default_risk": "medium",
  "risk_tags": ["package_install", "package_remove", "system_package_manager"],
  "subcommands": {
    "install": {"effects": [{"effect": "package.install", "resource": "system.packages"}]},
    "remove": {"effects": [{"effect": "package.remove", "resource": "system.packages"}]},
    "purge": {"effects": [{"effect": "package.remove", "resource": "system.packages"}]},
    "update": {"effects": [{"effect": "network.download", "resource": "package.index"}, {"effect": "package.read", "resource": "package.index"}]}
  },
  "examples": [{"command": "apt-get -s install curl", "explanation": "Simulate installing a package without changing the system."}],
  "templates": [{"command": "apt-get -s install {package}", "description": "Simulate a package installation."}]
}
