{
  "schema_version": "commandgraph.command_card.v1",
  "command": "npm",
  "summary": "Manage JavaScript packages and scripts.",
  "aliases": ["node package manager", "install package", "run script"],
  "intents": ["install npm package", "run package script", "update node dependencies"],
  "default_risk": "medium",
  "risk_tags": ["package_install", "network_access", "script_execution"],
  "subcommands": {
    "install": {"effects": [{"effect": "package.install", "resource": "node.environment"}]},
    "ci": {"effects": [{"effect": "package.install", "resource": "node.environment"}]},
    "update": {"effects": [{"effect": "package.install", "resource": "node.environment"}]},
    "uninstall": {"effects": [{"effect": "package.remove", "resource": "node.environment"}]},
    "remove": {"effects": [{"effect": "package.remove", "resource": "node.environment"}]},
    "list": {"effects": [{"effect": "package.read", "resource": "node.environment"}]},
    "ls": {"effects": [{"effect": "package.read", "resource": "node.environment"}]},
    "run": {"effects": [{"effect": "code.execute", "resource": "project.script"}]},
    "exec": {"effects": [{"effect": "code.execute", "resource": "package.executable"}]}
  },
  "examples": [{"command": "npm install", "explanation": "Install dependencies from package.json."}],
  "templates": [
    {"command": "npm install {package}", "description": "Install a JavaScript package."},
    {"command": "npm run <script>", "description": "Run a package script."}
  ]
}
